{
  "schemaVersion": "musubi.publication.public-release-manifest.v1",
  "releaseClass": "PUBLIC_SOURCE_PREVIEW",
  "payloadCommit": "9d7d2af6eaf745c9dec1d0f16c72179cff6379a2",
  "payloadManifestDigest": "sha256:6f5211552a9bc2650ebf2893c07d46a1c201d078cf9ebac2503cc47fa48d0c0a",
  "payloadTreeDigest": "sha256:1e1079eb63980b40ef87641c68471bdd09e589bf4c51c75f817f0b3fdced9eb2",
  "sourceUrl": "https://github.com/KeckuJp/musubi",
  "targetPackages": [
    "musubi-adapter-mavlink",
    "musubi-adapter-spi",
    "musubi-adapter-template",
    "musubi-adapter-usv-json",
    "musubi-cable-ml-eval",
    "musubi-cable-sim",
    "musubi-civil-reference-pack",
    "musubi-conformance",
    "musubi-core",
    "musubi-decoded-csv",
    "musubi-field-contracts",
    "musubi-integration-case",
    "musubi-jsonl-log",
    "musubi-miniseed2",
    "musubi-northbound",
    "musubi-recorded-readers",
    "musubi-reference-fanout",
    "musubi-reference-pipeline",
    "musubi-reference-readers",
    "musubi-reference-scenario",
    "musubi-reference-types",
    "musubi-reference-viewer",
    "musubi-reference-writers",
    "musubi-types"
  ],
  "copyright": "Copyright 2026 Musubi contributors",
  "noticePath": "NOTICE",
  "version": "0.0.0",
  "buildInstructions": "Use Rust 1.96.0 as pinned in rust-toolchain.toml; run cargo test --workspace --locked. See docs/reference-viewer.md for the native reference viewer and synthetic examples, and docs/recorded-observations.md for recorded input conversion. Optional Python 3.12 dependencies are documented separately. No hardware or device compatibility claim. See docs/offline-components.md for file fanout, authored verification and synthetic cable evaluation.",
  "license": {
    "spdxIdentifier": "Apache-2.0",
    "version": "2.0",
    "textPath": "LICENSE",
    "textDigest": "sha256:7ed699fe9e8b571355e5eabd72a707e15432bd38d61364926181a0b719538435"
  },
  "licenseOsiReview": {
    "reviewerIdentity": "Arai",
    "confirmationDate": "2026-09-10",
    "officialReferenceDigest": "sha256:11ad769f2d8ff205ba73515a3430ddcae22eb902ef89e81f4a0aa84c483bcad1",
    "reviewEvidenceDigest": "sha256:f94fb55f305bd48b1f4246dfe2163a8eff0739cfd78457a1c5a5a09a34998099"
  },
  "licenseRestrictionReview": {
    "deterministicScanResult": "NO_RESTRICTION_FOUND",
    "humanReviewResult": "NO_RESTRICTION_FOUND",
    "humanReviewerIdentity": "Arai",
    "evidenceDigest": "sha256:7afd48c40b335d23a31b03adb9ed9a90d94e084e20e0e48354f1bf5611f18387"
  },
  "dependencyLock": {
    "path": "Cargo.lock",
    "digest": "sha256:1806288e7715b19f59ccf86dc2154b5ba837bb27ed3f9403a51454c04a269bdf"
  },
  "sbom": {
    "sourceSbomPath": "sbom/source-sbom.json",
    "sourceSbomDigest": "sha256:b02f1a7635b750077f2c13da75495c58d96931ad54680eeb0df090327ec02bb6",
    "dependencySbomPath": "sbom/dependency-sbom.json",
    "dependencySbomDigest": "sha256:429363d8b4555e0daf20647c0871b04a2eab88413b172a557ade215545f356d8",
    "coveragePolicy": "SOURCE_PACKAGE_DEPENDENCY_INVENTORY_EXCLUDING_SBOM_AND_GENERATED_METADATA"
  },
  "policies": {
    "securityContact": "oss@kecku.com -- see SECURITY.md. Please do not open a public issue for something exploitable.",
    "contributionPolicy": "DCO 1.1 sign-off on every commit; no CLA. Contributions arrive as pull requests against this repository and are reviewed here. See CONTRIBUTING.md.",
    "trademarkPolicy": "Trademarks: see Section 6 of LICENSE.",
    "conformancePolicy": "musubi-conformance checks an adapter against the structural invariants of the object model and scans for a write surface the adapter has not declared. A pass is a statement about those invariants only. It is not certification, and it is not a claim of compatibility with any product, platform, protocol implementation or device; nothing here has been tested against one."
  },
  "maintainabilityStatement": "No independent-maintenance claim. Whether someone outside the original authors can maintain this has not been demonstrated.",
  "claimCeiling": "SOURCE_ONLY: no binary, and no compatibility with any product, platform or device is claimed or tested.",
  "nonClaims": [
    "NOT_ISOLATED_EXECUTION_VERIFIED",
    "NOT_BINARY_RELEASE",
    "NOT_PUBLIC_ALPHA",
    "NOT_PRODUCTION_READY",
    "NOT_FIELD_VALIDATED",
    "NOT_DEVICE_SUPPORT",
    "NOT_ALL_DEVICE_COMPATIBILITY",
    "NOT_HUMAN_MAINTAINER_VERIFIED",
    "NOT_INDEPENDENTLY_MAINTAINABLE",
    "NOT_COMMUNITY_READY",
    "INHERITED_LICENSE_POLICY_REVIEW_AND_SCAN_NOT_NEW_SOURCE_RIGHTS_CLEARANCE"
  ]
}
